{
  "schema_version": 1,
  "slug": "_fixture_recursive",
  "url": "",
  "pinned_commit": "",
  "tier": 0,
  "header_only": true,
  "toolchain_commit": "71dd1f5",
  "binder_commit": "3f5cf77",
  "outcome": "E",
  "furthest_gate": 6,
  "gate_results": {
    "3_strategy": "single_stage",
    "1_probe": "pass",
    "4_compile": "pass",
    "5_import": "pass",
    "6_correct": "pass"
  },
  "subset": {
    "reflect_args": [
      "^^tree::Node"
    ],
    "rationale": "Self-referential data structure (Node holds std::vector<Node>). Coverage for recursive types + vector-of-self member binding. NOT a BINDER-0004 regression (builds pre-fix too).",
    "skipped_features": []
  },
  "oracle": {
    "layers_used": [
      "L1_differential"
    ],
    "ground_truth_source": "native C++ oracle (oracle_native.cpp)",
    "pytest_summary": "2 passed in 0.01s"
  },
  "failure": {
    "code": null,
    "first_diagnostics": [],
    "signal": null
  },
  "toolchain_bug": {
    "status": "none"
  },
  "metrics": {
    "probe_seconds": 0.45,
    "binding_compile_seconds": 1.22
  },
  "artifacts": {},
  "notes": ""
}
