{
  "schema_version": 1,
  "slug": "abseil_crc",
  "url": "https://github.com/abseil/abseil-cpp",
  "pinned_commit": "20250814.2",
  "tier": 6,
  "header_only": false,
  "toolchain_commit": "fc2ca0d",
  "binder_commit": "820e828",
  "outcome": "E",
  "furthest_gate": 6,
  "gate_results": {
    "3_strategy": "single_stage",
    "1_probe": "pass",
    "4_compile": "pass",
    "5_import": "pass",
    "6_correct": "pass"
  },
  "subset": {
    "reflect_args": [
      "^^absl::crc32c_t",
      "^^crctest"
    ],
    "rationale": "absl::crc32c_t is a trivial strongly-typed value class bound head-on: default/explicit-uint32 constructors, explicit operator uint32_t -> __int__ (the value channel), and the namespace-scope operator<< -> __str__ ('%08x' hex). The computation/arithmetic API (ComputeCrc32c/ExtendCrc32c/ExtendCrc32cByZeroes/ConcatCrc32c/RemoveCrc32cPrefix/RemoveCrc32cSuffix) is free functions in ^^absl, so a crctest fixture namespace thin-wraps them (reflecting all of ^^absl is not tractable); four of them resolve to compiled code in libabsl_merged.a. Differential: CRC values, extend == compute-of-concat, concat/remove identities vs the native oracle.",
    "skipped_features": [
      "MemcpyCrc32c (void* buffer API has no clean Python mapping)",
      "operator==/!= are hidden friends (not enumerable namespace members); equality is exercised via the fixture eq() and the __int__ channel",
      "AbslStringify friend template (member template, skipped by design)"
    ]
  },
  "oracle": {
    "layers_used": [
      "L1_differential"
    ],
    "ground_truth_source": "native C++ oracle (oracle_native.cpp)",
    "pytest_summary": "5 passed in 0.01s"
  },
  "failure": {
    "code": null,
    "first_diagnostics": [],
    "signal": null
  },
  "toolchain_bug": {
    "status": "none"
  },
  "metrics": {
    "probe_seconds": 1.05,
    "binding_compile_seconds": 3.45
  },
  "artifacts": {},
  "notes": ""
}
