{
  "schema_version": 1,
  "slug": "fmt",
  "url": "https://github.com/fmtlib/fmt",
  "pinned_commit": "11.2.0",
  "tier": 2,
  "header_only": true,
  "toolchain_commit": "71dd1f5",
  "binder_commit": "3f5cf77",
  "outcome": "E",
  "furthest_gate": 6,
  "gate_results": {
    "3_strategy": "single_stage",
    "1_probe": "pass",
    "4_compile": "pass",
    "5_import": "pass",
    "6_correct": "pass"
  },
  "subset": {
    "reflect_args": [
      "^^fmt::color",
      "^^fmt::terminal_color",
      "^^fmt::emphasis",
      "^^fmt::format_int",
      "^^fmt::to_string<int>",
      "^^fmt::to_string<double>",
      "^^fmt::to_string<long long>",
      "^^fmttest"
    ],
    "rationale": "Four layers of REAL fmt surface, all differentially checked vs native fmt. (1) fmt's enums color (~140 CSS-color enumerators)/terminal_color/emphasis, reflected directly. (2) fmt's real concrete class fmt::format_int (its fast int->string formatter): ctor overloads + str()/c_str()/data()/size() bind, private member templates skipped. (3) fmt's real FORMATTING API bound DIRECTLY from its own function-template instantiations fmt::to_string<int/double/long long> (the binder binds fmt's own symbol, not a wrapper). fmt's format()/print() front-ends take a CONSTEVAL format_string<Args...> first parameter not constructible at runtime from Python, so they are intrinsically not directly bindable; to_string<T>/format_int are the directly-bindable formatting entry points. (4) A fixture namespace fmttest of concrete wrappers over the runtime fmt::format engine that drives the remaining Tier-2 themes: keyword arguments (P3096 names -> nb::arg), std::string/std::vector casters incl. fmt::join, and the member-function-template gap (Formatter::apply<T> skipped while ordinary members bind).",
    "skipped_features": [
      "fmt::format/format_to/print/println front-ends: intrinsically not directly bindable (consteval format_string<Args...> first param); runtime path exercised via fmttest wrappers",
      "fmt::format_int private member templates format_signed/format_unsigned (binder skips member templates)",
      "Formatter::apply<T> member function template (binder gracefully skips member templates)"
    ]
  },
  "oracle": {
    "layers_used": [
      "L1_differential"
    ],
    "ground_truth_source": "native C++ oracle (oracle_native.cpp)",
    "pytest_summary": "10 passed in 0.01s"
  },
  "failure": {
    "code": null,
    "first_diagnostics": [],
    "signal": null
  },
  "toolchain_bug": {
    "status": "none"
  },
  "metrics": {
    "probe_seconds": 0.74,
    "binding_compile_seconds": 3.18
  },
  "artifacts": {},
  "notes": ""
}
