{
  "schema_version": 1,
  "slug": "linalg",
  "url": "https://github.com/sgorsten/linalg",
  "pinned_commit": "v2.2",
  "tier": 0,
  "header_only": true,
  "toolchain_commit": "71dd1f5",
  "binder_commit": "c1debbd",
  "outcome": "E",
  "furthest_gate": 6,
  "gate_results": {
    "3_strategy": "single_stage",
    "1_probe": "pass",
    "4_compile": "pass",
    "5_import": "pass",
    "6_correct": "pass"
  },
  "subset": {
    "reflect_args": [
      "^^linalg::vec<float,3>"
    ],
    "rationale": "linalg is entirely templates; vec<float,3> is the only concrete auto-bindable surface (data x/y/z, ctors, operator[]). Free-function API is function templates (not auto-bound).",
    "skipped_features": [
      "free-function templates (dot/length/normalize/...)",
      "mat<> types"
    ]
  },
  "oracle": {
    "layers_used": [
      "L1_differential"
    ],
    "ground_truth_source": "native C++ oracle (oracle_native.cpp)",
    "pytest_summary": "3 passed in 0.01s"
  },
  "failure": {
    "code": null,
    "first_diagnostics": [],
    "signal": null
  },
  "toolchain_bug": {
    "status": "none"
  },
  "metrics": {
    "probe_seconds": 0.38,
    "binding_compile_seconds": 1.48
  },
  "artifacts": {},
  "notes": ""
}
