{
  "schema_version": 1,
  "slug": "abseil_btree",
  "url": "https://github.com/abseil/abseil-cpp",
  "pinned_commit": "20250814.2",
  "tier": 6,
  "header_only": false,
  "toolchain_commit": "651ff7a",
  "binder_commit": "89676a8",
  "outcome": "E",
  "furthest_gate": 6,
  "gate_results": {
    "3_strategy": "single_stage",
    "1_probe": "pass",
    "4_compile": "pass",
    "5_import": "pass",
    "6_correct": "pass"
  },
  "subset": {
    "reflect_args": [
      "^^absl::btree_map<int, std::string>",
      "^^absl::btree_set<int>",
      "^^bttest"
    ],
    "rationale": "absl::btree_map/btree_set bound HEAD-ON (the ordered half of BINDER-0008). The container_internal btree_map_container/btree_set_container/btree_container ancestry becomes the flattened/Python-base chain via reachability discovery; the heterogeneous query surface (contains/count/find/erase/at/equal_range/lower_bound/upper_bound and operator[] -> __getitem__ with C++ default-insert semantics) binds via default-instantiable member templates with the TC-0004 dispatch-level substitution. bttest supplies value-setting population (insert's pair<iterator,bool> return is not Python-expressible).",
    "skipped_features": [
      "ordered ITERATION from Python (begin/lower_bound return iterator types; a future __iter__/make_iterator feature -- order is exercised natively in the oracle only)",
      "insert/extract/merge from Python (iterator/node_handle returns)",
      "emplace/try_emplace/insert_or_assign (parameter-pack member templates, skipped by design)"
    ]
  },
  "oracle": {
    "layers_used": [
      "L1_differential"
    ],
    "ground_truth_source": "native C++ oracle (oracle_native.cpp)",
    "pytest_summary": "4 passed in 0.01s"
  },
  "failure": {
    "code": null,
    "first_diagnostics": [],
    "signal": null
  },
  "toolchain_bug": {
    "status": "none"
  },
  "metrics": {
    "probe_seconds": 1.4,
    "binding_compile_seconds": 15.03
  },
  "artifacts": {},
  "notes": ""
}
