{
  "schema_version": 1,
  "slug": "glm",
  "url": "https://github.com/g-truc/glm",
  "pinned_commit": "1.0.1",
  "tier": 1,
  "header_only": true,
  "toolchain_commit": "71dd1f5",
  "binder_commit": "c1debbd",
  "outcome": "E",
  "furthest_gate": 6,
  "gate_results": {
    "3_strategy": "single_stage",
    "1_probe": "pass",
    "4_compile": "pass",
    "5_import": "pass",
    "6_correct": "pass"
  },
  "subset": {
    "reflect_args": [
      "^^glm::vec3",
      "^^glm::vec4"
    ],
    "rationale": "glm is entirely templates; bind concrete vec3/vec4. Components live in an anonymous union (not exposed, BINDER-0002); usable surface is constructors, operator[]->__getitem__, static length(). Free-function API is function templates (not auto-bound).",
    "skipped_features": [
      "anonymous-union components x/y/z/w (BINDER-0002)",
      "free-function templates (length/dot/cross/normalize)",
      "mat types",
      "operators (free function templates)"
    ]
  },
  "oracle": {
    "layers_used": [
      "L1_differential"
    ],
    "ground_truth_source": "native C++ oracle (oracle_native.cpp)",
    "pytest_summary": "3 passed in 0.01s"
  },
  "failure": {
    "code": null,
    "first_diagnostics": [],
    "signal": null
  },
  "toolchain_bug": {
    "status": "none"
  },
  "metrics": {
    "probe_seconds": 0.3,
    "binding_compile_seconds": 1.55
  },
  "artifacts": {},
  "notes": ""
}
