{
  "schema_version": 1,
  "slug": "abseil",
  "url": "https://github.com/abseil/abseil-cpp",
  "pinned_commit": "20250814.2",
  "tier": 6,
  "header_only": false,
  "toolchain_commit": "269d3e3",
  "binder_commit": "b5cfbba",
  "outcome": "E",
  "furthest_gate": 6,
  "gate_results": {
    "3_strategy": "single_stage",
    "1_probe": "pass",
    "4_compile": "pass",
    "5_import": "pass",
    "6_correct": "pass"
  },
  "subset": {
    "reflect_args": [
      "^^absl::InlinedVector<int, 4>",
      "^^absl::InlinedVector<double, 2>"
    ],
    "rationale": "Abseil's value to the prove-out is the quantity of complex, fully-specialized concrete data structures that bind DIRECTLY (no fixture wrappers) \u2014 each named specialization is reflected head-on. This run binds two specializations of absl::InlinedVector (a small-buffer-optimized vector): <int,4> and <double,2>, to distinct Python types InlinedVectorInt4/InlinedVectorDouble2, with the full push_back/pop_back/at/operator[]/front/back/size/capacity/clear/empty/reserve/resize/erase/insert surface; differentially checked vs native Abseil (incl. the small-buffer spill -> heap capacity growth). It is the first NON-header-only corpus lib: the .cc-defined ThrowStdOutOfRange (from at()) is linked via the new extra_sources machinery. Two real binder-coverage findings were surfaced while scoping and are deferred: BINDER-0006 (absl::FixedArray internal zero-length-array storage member) and BINDER-0007 (absl::int128 free operator<< -> incomplete std::ostream caster).",
    "skipped_features": [
      "absl::FixedArray (BINDER-0006: internal StorageElementWrapper zero-length int[0] member breaks def_rw)",
      "absl::int128 (BINDER-0007: free operator<<(std::ostream&,...) makes the binder instantiate an incomplete std::ostream caster)",
      "absl::flat_hash_map/flat_hash_set (deeper link surface: absl::hash/container_internal .cc units \u2014 next step after InlinedVector banks E)"
    ]
  },
  "oracle": {
    "layers_used": [
      "L1_differential"
    ],
    "ground_truth_source": "native C++ oracle (oracle_native.cpp)",
    "pytest_summary": "5 passed in 0.01s"
  },
  "failure": {
    "code": null,
    "first_diagnostics": [],
    "signal": null
  },
  "toolchain_bug": {
    "status": "none"
  },
  "metrics": {
    "probe_seconds": 0.65,
    "binding_compile_seconds": 4.21
  },
  "artifacts": {},
  "notes": ""
}
