{
  "schema_version": 1,
  "slug": "abseil_statusor",
  "url": "https://github.com/abseil/abseil-cpp",
  "pinned_commit": "20250814.2",
  "tier": 6,
  "header_only": false,
  "toolchain_commit": "01c87cf",
  "binder_commit": "615e79c",
  "outcome": "E",
  "furthest_gate": 6,
  "gate_results": {
    "3_strategy": "single_stage",
    "1_probe": "pass",
    "4_compile": "pass",
    "5_import": "pass",
    "6_correct": "pass"
  },
  "subset": {
    "reflect_args": [
      "^^absl::StatusOr<int>",
      "^^absl::StatusOr<std::string>",
      "^^absl::StatusOr<double>",
      "^^absl::Status",
      "^^absl::StatusCode",
      "^^sotest"
    ],
    "rationale": "absl::StatusOr<T> bound as three real specializations (int/std::string/double): ok(), status() (returns const Status& so Status+StatusCode are bound in-module), IgnoreError(), and value() -- bound HEAD-ON through its using-redeclaration from the PRIVATE internal_statusor::OperatorBase<T> base via entity-proxy support (BINDER-0009, -fentity-proxy-reflection; found+fixed TC-0003: three toolchain bugs around entity proxies). All of StatusOr's value/converting CONSTRUCTORS are templates (enable_if'd U&&), which the binder skips by design, so the sotest fixture namespace supplies ok_*/err_* factories (the Duration/Time pattern); get_* accessors remain as a differential cross-check channel.",
    "skipped_features": [
      "operator*/operator-> re-exports (unary deref has no Python dunder; value() is the access path)",
      "value construction/assignment from Python literals (all converting ctors are templates; factories instead)",
      "value_or/emplace/AssignStatus (member templates needing explicit args or packs; Assign* re-exports have template underlyings -- skipped by design)",
      "rvalue-ref-qualified &&-overloads (filtered via the binder-spec completeness gate; the decl predicate misreports through proxies, see TC-0003 addendum)"
    ]
  },
  "oracle": {
    "layers_used": [
      "L1_differential"
    ],
    "ground_truth_source": "native C++ oracle (oracle_native.cpp)",
    "pytest_summary": "7 passed in 0.01s"
  },
  "failure": {
    "code": null,
    "first_diagnostics": [],
    "signal": null
  },
  "toolchain_bug": {
    "status": "none"
  },
  "metrics": {
    "probe_seconds": 1.7,
    "binding_compile_seconds": 29.8
  },
  "artifacts": {},
  "notes": ""
}
